11:52:41.533858 IP netviews.ssh > _gateway.34440: Flags [P.], seq 711104471:711104659, ack 1912175287, win 62780, length 188
11:52:41.739737 IP netviews.ssh > _gateway.34440: Flags [P.], seq 0:188, ack 1, win 62780, length 188
11:52:42.159741 IP netviews.ssh > _gateway.34440: Flags [P.], seq 0:188, ack 1, win 62780, length 188
11:52:42.503647 IP _gateway.34440 > netviews.ssh: Flags [.], ack 188, win 65535, length 0
11:52:42.503647 IP _gateway.34440 > netviews.ssh: Flags [.], ack 188, win 65535, length 0
11:52:42.503648 IP _gateway.34440 > netviews.ssh: Flags [.], ack 188, win 65535, length 0
11:52:42.513654 IP netviews.53495 > 10.0.2.3.domain: 41524+ [1au] PTR? 2.2.0.10.in-addr.arpa. (50)
11:52:42.514507 IP 10.0.2.3.domain > netviews.53495: 41524 NXDomain* 0/1/1 (85)
11:52:42.514742 IP netviews.53495 > 10.0.2.3.domain: 41524+ PTR? 2.2.0.10.in-addr.arpa. (39)
11:52:42.515276 IP 10.0.2.3.domain > netviews.53495: 41524 NXDomain* 0/1/0 (74)
11:52:42.516538 IP netviews.56653 > 10.0.2.3.domain: 25940+ [1au] PTR? 15.2.0.10.in-addr.arpa. (51)
11:52:42.517160 IP 10.0.2.3.domain > netviews.56653: 25940 NXDomain* 0/1/1 (86)
11:52:42.517350 IP netviews.56653 > 10.0.2.3.domain: 25940+ PTR? 15.2.0.10.in-addr.arpa. (40)
11:52:42.517834 IP 10.0.2.3.domain > netviews.56653: 25940 NXDomain* 0/1/0 (75)
11:52:43.536752 IP netviews.53734 > 10.0.2.3.domain: 47936+ [1au] PTR? 3.2.0.10.in-addr.arpa. (50)
11:52:43.537492 IP 10.0.2.3.domain > netviews.53734: 47936 NXDomain* 0/1/1 (85)
11:52:43.537731 IP netviews.53734 > 10.0.2.3.domain: 47936+ PTR? 3.2.0.10.in-addr.arpa. (39)
11:52:43.538194 IP 10.0.2.3.domain > netviews.53734: 47936 NXDomain* 0/1/0 (74)
11:52:47.567735 ARP, Request who-has 10.0.2.3 tell netviews, length 28
11:52:47.568096 ARP, Reply 10.0.2.3 is-at 52:55:0a:00:02:03 (oui Unknown), length 50
11:52:52.994534 IP _gateway.34436 > netviews.ssh: Flags [P.], seq 1910461579:1910461623, ack 3685154055, win 65535, length 44
11:52:52.995438 IP netviews.ssh > _gateway.34436: Flags [P.], seq 1:45, ack 44, win 62780, length 44
11:52:52.998101 IP _gateway.34436 > netviews.ssh: Flags [.], ack 45, win 65535, length 0
11:52:53.359569 IP _gateway.34436 > netviews.ssh: Flags [P.], seq 44:88, ack 45, win 65535, length 44
11:52:53.360474 IP netviews.ssh > _gateway.34436: Flags [P.], seq 45:241, ack 88, win 62780, length 196
11:52:53.363014 IP _gateway.34436 > netviews.ssh: Flags [.], ack 241, win 65535, length 0
11:52:53.897410 IP _gateway.34436 > netviews.ssh: Flags [P.], seq 88:124, ack 241, win 65535, length 36
11:52:53.898119 IP netviews.ssh > _gateway.34436: Flags [P.], seq 241:277, ack 124, win 62780, length 36
11:52:53.900736 IP _gateway.34436 > netviews.ssh: Flags [.], ack 277, win 65535, length 0
11:52:54.010956 IP netviews.ssh > _gateway.34436: Flags [P.], seq 277:369, ack 124, win 62780, length 92
11:52:54.011397 IP _gateway.34436 > netviews.ssh: Flags [.], ack 369, win 65535, length 0
11:52:54.019398 IP netviews.ssh > _gateway.34436: Flags [P.], seq 369:453, ack 124, win 62780, length 84
11:52:54.019761 IP _gateway.34436 > netviews.ssh: Flags [.], ack 453, win 65535, length 0
11:52:54.019919 IP netviews.ssh > _gateway.34436: Flags [P.], seq 453:513, ack 124, win 62780, length 60
11:52:54.020102 IP _gateway.34436 > netviews.ssh: Flags [.], ack 513, win 65535, length 0
11:52:54.048011 IP netviews.ssh > _gateway.34432: Flags [P.], seq 125731886:125732114, ack 1908152791, win 62780, length 228
11:52:54.048355 IP _gateway.34432 > netviews.ssh: Flags [.], ack 228, win 65535, length 0
11:52:54.055329 IP netviews.ssh > _gateway.34436: Flags [P.], seq 513:557, ack 124, win 62780, length 44
11:52:54.055657 IP _gateway.34436 > netviews.ssh: Flags [.], ack 557, win 65535, length 0
11:52:54.081291 IP netviews.ssh > _gateway.34436: Flags [P.], seq 557:601, ack 124, win 62780, length 44
11:52:54.081672 IP _gateway.34436 > netviews.ssh: Flags [.], ack 601, win 65535, length 0
11:52:54.088497 IP netviews.ssh > _gateway.34432: Flags [P.], seq 228:496, ack 1, win 62780, length 268
11:52:54.088813 IP _gateway.34432 > netviews.ssh: Flags [.], ack 496, win 65535, length 0
11:52:54.088983 IP netviews.ssh > _gateway.34432: Flags [P.], seq 496:772, ack 1, win 62780, length 276
11:52:54.089164 IP _gateway.34432 > netviews.ssh: Flags [.], ack 772, win 65535, length 0
11:52:54.102915 IP netviews.ssh > _gateway.34436: Flags [P.], seq 601:645, ack 124, win 62780, length 44
11:52:54.103009 IP _gateway.34436 > netviews.ssh: Flags [.], ack 645, win 65535, length 0
11:52:54.129786 IP netviews.ssh > _gateway.34436: Flags [P.], seq 645:689, ack 124, win 62780, length 44
11:52:54.130163 IP _gateway.34436 > netviews.ssh: Flags [.], ack 689, win 65535, length 0
11:52:54.157206 IP netviews.ssh > _gateway.34436: Flags [P.], seq 689:733, ack 124, win 62780, length 44
11:52:54.157543 IP _gateway.34436 > netviews.ssh: Flags [.], ack 733, win 65535, length 0
11:52:54.184577 IP netviews.ssh > _gateway.34436: Flags [P.], seq 733:777, ack 124, win 62780, length 44
11:52:54.184913 IP _gateway.34436 > netviews.ssh: Flags [.], ack 777, win 65535, length 0
11:52:54.208269 IP netviews.ssh > _gateway.34436: Flags [P.], seq 777:821, ack 124, win 62780, length 44
11:52:54.208592 IP _gateway.34436 > netviews.ssh: Flags [.], ack 821, win 65535, length 0
11:52:54.231353 IP netviews.ssh > _gateway.34436: Flags [P.], seq 821:865, ack 124, win 62780, length 44
11:52:54.231749 IP _gateway.34436 > netviews.ssh: Flags [.], ack 865, win 65535, length 0
11:52:54.258409 IP netviews.ssh > _gateway.34436: Flags [P.], seq 865:909, ack 124, win 62780, length 44
11:52:54.258775 IP _gateway.34436 > netviews.ssh: Flags [.], ack 909, win 65535, length 0
11:52:54.281906 IP netviews.ssh > _gateway.34436: Flags [P.], seq 909:953, ack 124, win 62780, length 44
11:52:54.282016 IP _gateway.34436 > netviews.ssh: Flags [.], ack 953, win 65535, length 0
11:52:54.306097 IP netviews.ssh > _gateway.34436: Flags [P.], seq 953:997, ack 124, win 62780, length 44
11:52:54.306445 IP _gateway.34436 > netviews.ssh: Flags [.], ack 997, win 65535, length 0
11:52:54.329383 IP netviews.ssh > _gateway.34436: Flags [P.], seq 997:1065, ack 124, win 62780, length 68
11:52:54.329725 IP _gateway.34436 > netviews.ssh: Flags [.], ack 1065, win 65535, length 0
11:52:54.395043 IP netviews.ssh > _gateway.34436: Flags [P.], seq 1065:1109, ack 124, win 62780, length 44
11:52:54.395450 IP _gateway.34436 > netviews.ssh: Flags [.], ack 1109, win 65535, length 0
11:52:54.423721 IP netviews.ssh > _gateway.34436: Flags [P.], seq 1109:1153, ack 124, win 62780, length 44
11:52:54.424039 IP _gateway.34436 > netviews.ssh: Flags [.], ack 1153, win 65535, length 0
11:52:54.451938 IP netviews.ssh > _gateway.34436: Flags [P.], seq 1153:1197, ack 124, win 62780, length 44
11:52:54.452240 IP _gateway.34436 > netviews.ssh: Flags [.], ack 1197, win 65535, length 0
11:52:54.480536 IP netviews.ssh > _gateway.34436: Flags [P.], seq 1197:1241, ack 124, win 62780, length 44
11:52:54.480834 IP _gateway.34436 > netviews.ssh: Flags [.], ack 1241, win 65535, length 0
11:52:54.508320 IP netviews.ssh > _gateway.34436: Flags [P.], seq 1241:1285, ack 124, win 62780, length 44
11:52:54.508622 IP _gateway.34436 > netviews.ssh: Flags [.], ack 1285, win 65535, length 0
11:52:54.536974 IP netviews.ssh > _gateway.34436: Flags [P.], seq 1285:1329, ack 124, win 62780, length 44
11:52:54.537297 IP _gateway.34436 > netviews.ssh: Flags [.], ack 1329, win 65535, length 0
11:52:54.561318 IP netviews.ssh > _gateway.34436: Flags [P.], seq 1329:1373, ack 124, win 62780, length 44
11:52:54.561408 IP _gateway.34436 > netviews.ssh: Flags [.], ack 1373, win 65535, length 0
11:52:54.591523 IP netviews.ssh > _gateway.34436: Flags [P.], seq 1373:1417, ack 124, win 62780, length 44
11:52:54.591900 IP _gateway.34436 > netviews.ssh: Flags [.], ack 1417, win 65535, length 0
11:52:54.619940 IP netviews.ssh > _gateway.34436: Flags [P.], seq 1417:1461, ack 124, win 62780, length 44
11:52:54.620264 IP _gateway.34436 > netviews.ssh: Flags [.], ack 1461, win 65535, length 0
11:52:54.648222 IP netviews.ssh > _gateway.34436: Flags [P.], seq 1461:1521, ack 124, win 62780, length 60
11:52:54.648526 IP _gateway.34436 > netviews.ssh: Flags [.], ack 1521, win 65535, length 0
11:52:54.665173 IP netviews.ssh > _gateway.34436: Flags [P.], seq 1521:1573, ack 124, win 62780, length 52
11:52:54.665525 IP _gateway.34436 > netviews.ssh: Flags [.], ack 1573, win 65535, length 0
11:52:54.686576 IP netviews.ssh > _gateway.34436: Flags [P.], seq 1573:1625, ack 124, win 62780, length 52
11:52:54.686815 IP _gateway.34436 > netviews.ssh: Flags [.], ack 1625, win 65535, length 0
11:52:54.695532 IP netviews.ssh > _gateway.34436: Flags [P.], seq 1625:1669, ack 124, win 62780, length 44
11:52:54.695803 IP _gateway.34436 > netviews.ssh: Flags [.], ack 1669, win 65535, length 0
11:52:54.716393 IP netviews.ssh > _gateway.34436: Flags [P.], seq 1669:1721, ack 124, win 62780, length 52
11:52:54.716721 IP _gateway.34436 > netviews.ssh: Flags [.], ack 1721, win 65535, length 0
11:52:54.732074 IP netviews.ssh > _gateway.34436: Flags [P.], seq 1721:1773, ack 124, win 62780, length 52
11:52:54.732380 IP _gateway.34436 > netviews.ssh: Flags [.], ack 1773, win 65535, length 0
11:52:54.738248 IP netviews.ssh > _gateway.34436: Flags [P.], seq 1773:1817, ack 124, win 62780, length 44
11:52:54.738547 IP _gateway.34436 > netviews.ssh: Flags [.], ack 1817, win 65535, length 0
11:52:54.752627 IP netviews.ssh > _gateway.34436: Flags [P.], seq 1817:1869, ack 124, win 62780, length 52
11:52:54.753004 IP _gateway.34436 > netviews.ssh: Flags [.], ack 1869, win 65535, length 0
11:52:54.769760 IP netviews.ssh > _gateway.34436: Flags [P.], seq 1869:1921, ack 124, win 62780, length 52
11:52:54.770090 IP _gateway.34436 > netviews.ssh: Flags [.], ack 1921, win 65535, length 0
11:52:54.777538 IP netviews.ssh > _gateway.34436: Flags [P.], seq 1921:1965, ack 124, win 62780, length 44
11:52:54.777856 IP _gateway.34436 > netviews.ssh: Flags [.], ack 1965, win 65535, length 0
11:52:54.791803 IP netviews.ssh > _gateway.34436: Flags [P.], seq 1965:2017, ack 124, win 62780, length 52
11:52:54.792106 IP _gateway.34436 > netviews.ssh: Flags [.], ack 2017, win 65535, length 0
11:52:54.806737 IP netviews.ssh > _gateway.34436: Flags [P.], seq 2017:2069, ack 124, win 62780, length 52
11:52:54.806967 IP _gateway.34436 > netviews.ssh: Flags [.], ack 2069, win 65535, length 0
11:52:54.814151 IP netviews.ssh > _gateway.34436: Flags [P.], seq 2069:2113, ack 124, win 62780, length 44
11:52:54.814475 IP _gateway.34436 > netviews.ssh: Flags [.], ack 2113, win 65535, length 0
11:52:54.829401 IP netviews.ssh > _gateway.34436: Flags [P.], seq 2113:2165, ack 124, win 62780, length 52
11:52:54.829778 IP _gateway.34436 > netviews.ssh: Flags [.], ack 2165, win 65535, length 0
11:52:54.844173 IP netviews.ssh > _gateway.34436: Flags [P.], seq 2165:2217, ack 124, win 62780, length 52
11:52:54.844455 IP _gateway.34436 > netviews.ssh: Flags [.], ack 2217, win 65535, length 0
11:52:54.849085 IP netviews.ssh > _gateway.34436: Flags [P.], seq 2217:2261, ack 124, win 62780, length 44
11:52:54.849388 IP _gateway.34436 > netviews.ssh: Flags [.], ack 2261, win 65535, length 0
11:52:54.878537 IP netviews.ssh > _gateway.34436: Flags [P.], seq 2261:2313, ack 124, win 62780, length 52
11:52:54.878926 IP _gateway.34436 > netviews.ssh: Flags [.], ack 2313, win 65535, length 0
11:52:54.903082 IP netviews.ssh > _gateway.34436: Flags [P.], seq 2313:2365, ack 124, win 62780, length 52
11:52:54.903402 IP _gateway.34436 > netviews.ssh: Flags [.], ack 2365, win 65535, length 0
11:52:54.911413 IP netviews.ssh > _gateway.34436: Flags [P.], seq 2365:2409, ack 124, win 62780, length 44
11:52:54.911810 IP _gateway.34436 > netviews.ssh: Flags [.], ack 2409, win 65535, length 0
11:52:54.928671 IP netviews.ssh > _gateway.34436: Flags [P.], seq 2409:2461, ack 124, win 62780, length 52
11:52:54.929079 IP _gateway.34436 > netviews.ssh: Flags [.], ack 2461, win 65535, length 0
11:52:54.941763 IP netviews.ssh > _gateway.34436: Flags [P.], seq 2461:2513, ack 124, win 62780, length 52
11:52:54.942091 IP _gateway.34436 > netviews.ssh: Flags [.], ack 2513, win 65535, length 0
11:52:54.947585 IP netviews.ssh > _gateway.34436: Flags [P.], seq 2513:2557, ack 124, win 62780, length 44
11:52:54.947947 IP _gateway.34436 > netviews.ssh: Flags [.], ack 2557, win 65535, length 0
11:52:54.962009 IP netviews.ssh > _gateway.34436: Flags [P.], seq 2557:2609, ack 124, win 62780, length 52
11:52:54.962295 IP _gateway.34436 > netviews.ssh: Flags [.], ack 2609, win 65535, length 0
11:52:54.975238 IP netviews.ssh > _gateway.34436: Flags [P.], seq 2609:2661, ack 124, win 62780, length 52
11:52:54.975568 IP _gateway.34436 > netviews.ssh: Flags [.], ack 2661, win 65535, length 0
11:52:54.985080 IP netviews.ssh > _gateway.34436: Flags [P.], seq 2661:2705, ack 124, win 62780, length 44
11:52:54.985382 IP _gateway.34436 > netviews.ssh: Flags [.], ack 2705, win 65535, length 0
11:52:54.997749 IP netviews.ssh > _gateway.34436: Flags [P.], seq 2705:2757, ack 124, win 62780, length 52
11:52:54.998115 IP _gateway.34436 > netviews.ssh: Flags [.], ack 2757, win 65535, length 0
11:52:55.009603 IP netviews.ssh > _gateway.34436: Flags [P.], seq 2757:2809, ack 124, win 62780, length 52
11:52:55.009970 IP _gateway.34436 > netviews.ssh: Flags [.], ack 2809, win 65535, length 0
11:52:55.015078 IP netviews.ssh > _gateway.34436: Flags [P.], seq 2809:2853, ack 124, win 62780, length 44
11:52:55.015430 IP _gateway.34436 > netviews.ssh: Flags [.], ack 2853, win 65535, length 0
11:52:55.031394 IP netviews.ssh > _gateway.34436: Flags [P.], seq 2853:2905, ack 124, win 62780, length 52
11:52:55.031756 IP _gateway.34436 > netviews.ssh: Flags [.], ack 2905, win 65535, length 0
11:52:55.042861 IP netviews.ssh > _gateway.34436: Flags [P.], seq 2905:2957, ack 124, win 62780, length 52
11:52:55.042989 IP _gateway.34436 > netviews.ssh: Flags [.], ack 2957, win 65535, length 0
11:52:55.049268 IP netviews.ssh > _gateway.34436: Flags [P.], seq 2957:3001, ack 124, win 62780, length 44
11:52:55.049398 IP _gateway.34436 > netviews.ssh: Flags [.], ack 3001, win 65535, length 0
11:52:55.062898 IP netviews.ssh > _gateway.34436: Flags [P.], seq 3001:3053, ack 124, win 62780, length 52
11:52:55.063201 IP _gateway.34436 > netviews.ssh: Flags [.], ack 3053, win 65535, length 0
11:52:55.076031 IP netviews.ssh > _gateway.34436: Flags [P.], seq 3053:3105, ack 124, win 62780, length 52
11:52:55.076238 IP _gateway.34436 > netviews.ssh: Flags [.], ack 3105, win 65535, length 0
11:52:55.084560 IP netviews.ssh > _gateway.34436: Flags [P.], seq 3105:3149, ack 124, win 62780, length 44
11:52:55.084859 IP _gateway.34436 > netviews.ssh: Flags [.], ack 3149, win 65535, length 0
11:52:55.098391 IP netviews.ssh > _gateway.34436: Flags [P.], seq 3149:3201, ack 124, win 62780, length 52
11:52:55.098667 IP _gateway.34436 > netviews.ssh: Flags [.], ack 3201, win 65535, length 0
11:52:55.112625 IP netviews.ssh > _gateway.34436: Flags [P.], seq 3201:3253, ack 124, win 62780, length 52
11:52:55.112821 IP _gateway.34436 > netviews.ssh: Flags [.], ack 3253, win 65535, length 0
11:52:55.118420 IP netviews.ssh > _gateway.34436: Flags [P.], seq 3253:3297, ack 124, win 62780, length 44
11:52:55.118579 IP _gateway.34436 > netviews.ssh: Flags [.], ack 3297, win 65535, length 0
11:52:55.135033 IP netviews.ssh > _gateway.34436: Flags [P.], seq 3297:3349, ack 124, win 62780, length 52
11:52:55.135311 IP _gateway.34436 > netviews.ssh: Flags [.], ack 3349, win 65535, length 0
11:52:55.149754 IP netviews.ssh > _gateway.34436: Flags [P.], seq 3349:3401, ack 124, win 62780, length 52
11:52:55.150026 IP _gateway.34436 > netviews.ssh: Flags [.], ack 3401, win 65535, length 0
11:52:55.158246 IP netviews.ssh > _gateway.34436: Flags [P.], seq 3401:3445, ack 124, win 62780, length 44
11:52:55.158520 IP _gateway.34436 > netviews.ssh: Flags [.], ack 3445, win 65535, length 0
11:52:55.173302 IP netviews.ssh > _gateway.34436: Flags [P.], seq 3445:3497, ack 124, win 62780, length 52
11:52:55.173569 IP _gateway.34436 > netviews.ssh: Flags [.], ack 3497, win 65535, length 0
11:52:55.193993 IP netviews.ssh > _gateway.34436: Flags [P.], seq 3497:3549, ack 124, win 62780, length 52
11:52:55.194199 IP _gateway.34436 > netviews.ssh: Flags [.], ack 3549, win 65535, length 0
11:52:55.201882 IP netviews.ssh > _gateway.34436: Flags [P.], seq 3549:3593, ack 124, win 62780, length 44
11:52:55.202071 IP _gateway.34436 > netviews.ssh: Flags [.], ack 3593, win 65535, length 0
11:52:55.219587 IP netviews.ssh > _gateway.34436: Flags [P.], seq 3593:3645, ack 124, win 62780, length 52
11:52:55.219904 IP _gateway.34436 > netviews.ssh: Flags [.], ack 3645, win 65535, length 0
11:52:55.238203 IP netviews.ssh > _gateway.34436: Flags [P.], seq 3645:3697, ack 124, win 62780, length 52
11:52:55.238455 IP _gateway.34436 > netviews.ssh: Flags [.], ack 3697, win 65535, length 0
11:52:55.244269 IP netviews.ssh > _gateway.34436: Flags [P.], seq 3697:3741, ack 124, win 62780, length 44
11:52:55.244415 IP _gateway.34436 > netviews.ssh: Flags [.], ack 3741, win 65535, length 0
11:52:55.260993 IP netviews.ssh > _gateway.34436: Flags [P.], seq 3741:3793, ack 124, win 62780, length 52
11:52:55.261171 IP _gateway.34436 > netviews.ssh: Flags [.], ack 3793, win 65535, length 0
11:52:55.282657 IP netviews.ssh > _gateway.34436: Flags [P.], seq 3793:3845, ack 124, win 62780, length 52
11:52:55.282979 IP _gateway.34436 > netviews.ssh: Flags [.], ack 3845, win 65535, length 0
11:52:55.292657 IP netviews.ssh > _gateway.34436: Flags [P.], seq 3845:3889, ack 124, win 62780, length 44
11:52:55.292939 IP _gateway.34436 > netviews.ssh: Flags [.], ack 3889, win 65535, length 0
11:52:55.306889 IP netviews.ssh > _gateway.34436: Flags [P.], seq 3889:3941, ack 124, win 62780, length 52
11:52:55.307060 IP _gateway.34436 > netviews.ssh: Flags [.], ack 3941, win 65535, length 0
11:52:55.322805 IP netviews.ssh > _gateway.34436: Flags [P.], seq 3941:3993, ack 124, win 62780, length 52
11:52:55.322985 IP _gateway.34436 > netviews.ssh: Flags [.], ack 3993, win 65535, length 0
11:52:55.331286 IP netviews.ssh > _gateway.34436: Flags [P.], seq 3993:4037, ack 124, win 62780, length 44
11:52:55.331538 IP _gateway.34436 > netviews.ssh: Flags [.], ack 4037, win 65535, length 0
11:52:55.347534 IP netviews.ssh > _gateway.34436: Flags [P.], seq 4037:4089, ack 124, win 62780, length 52
11:52:55.347828 IP _gateway.34436 > netviews.ssh: Flags [.], ack 4089, win 65535, length 0
11:52:55.364549 IP netviews.ssh > _gateway.34436: Flags [P.], seq 4089:4141, ack 124, win 62780, length 52
11:52:55.364688 IP _gateway.34436 > netviews.ssh: Flags [.], ack 4141, win 65535, length 0
11:52:55.371222 IP netviews.ssh > _gateway.34436: Flags [P.], seq 4141:4185, ack 124, win 62780, length 44
11:52:55.371341 IP _gateway.34436 > netviews.ssh: Flags [.], ack 4185, win 65535, length 0
11:52:55.387569 IP netviews.ssh > _gateway.34436: Flags [P.], seq 4185:4237, ack 124, win 62780, length 52
11:52:55.387834 IP _gateway.34436 > netviews.ssh: Flags [.], ack 4237, win 65535, length 0
11:52:55.404654 IP netviews.ssh > _gateway.34436: Flags [P.], seq 4237:4289, ack 124, win 62780, length 52
11:52:55.404921 IP _gateway.34436 > netviews.ssh: Flags [.], ack 4289, win 65535, length 0
11:52:55.409940 IP netviews.ssh > _gateway.34436: Flags [P.], seq 4289:4333, ack 124, win 62780, length 44
11:52:55.410178 IP _gateway.34436 > netviews.ssh: Flags [.], ack 4333, win 65535, length 0
11:52:55.427714 IP netviews.ssh > _gateway.34436: Flags [P.], seq 4333:4385, ack 124, win 62780, length 52
11:52:55.428040 IP _gateway.34436 > netviews.ssh: Flags [.], ack 4385, win 65535, length 0
11:52:55.447194 IP netviews.ssh > _gateway.34436: Flags [P.], seq 4385:4437, ack 124, win 62780, length 52
11:52:55.447338 IP _gateway.34436 > netviews.ssh: Flags [.], ack 4437, win 65535, length 0
11:52:55.453795 IP netviews.ssh > _gateway.34436: Flags [P.], seq 4437:4481, ack 124, win 62780, length 44
11:52:55.453942 IP _gateway.34436 > netviews.ssh: Flags [.], ack 4481, win 65535, length 0
11:52:55.465186 IP netviews.ssh > _gateway.34436: Flags [P.], seq 4481:4533, ack 124, win 62780, length 52
11:52:55.465455 IP _gateway.34436 > netviews.ssh: Flags [.], ack 4533, win 65535, length 0
11:52:55.482733 IP netviews.ssh > _gateway.34436: Flags [P.], seq 4533:4585, ack 124, win 62780, length 52
11:52:55.482971 IP _gateway.34436 > netviews.ssh: Flags [.], ack 4585, win 65535, length 0
11:52:55.487218 IP netviews.ssh > _gateway.34436: Flags [P.], seq 4585:4629, ack 124, win 62780, length 44
11:52:55.487359 IP _gateway.34436 > netviews.ssh: Flags [.], ack 4629, win 65535, length 0
11:52:55.501308 IP netviews.ssh > _gateway.34436: Flags [P.], seq 4629:4681, ack 124, win 62780, length 52
11:52:55.502420 IP _gateway.34436 > netviews.ssh: Flags [.], ack 4681, win 65535, length 0
11:52:55.517804 IP netviews.ssh > _gateway.34436: Flags [P.], seq 4681:4733, ack 124, win 62780, length 52
11:52:55.518075 IP _gateway.34436 > netviews.ssh: Flags [.], ack 4733, win 65535, length 0
11:52:55.523221 IP netviews.ssh > _gateway.34436: Flags [P.], seq 4733:4777, ack 124, win 62780, length 44
11:52:55.523459 IP _gateway.34436 > netviews.ssh: Flags [.], ack 4777, win 65535, length 0
11:52:55.542013 IP netviews.ssh > _gateway.34436: Flags [P.], seq 4777:4829, ack 124, win 62780, length 52
11:52:55.542318 IP _gateway.34436 > netviews.ssh: Flags [.], ack 4829, win 65535, length 0
11:52:55.554443 IP netviews.ssh > _gateway.34436: Flags [P.], seq 4829:4881, ack 124, win 62780, length 52
11:52:55.554683 IP _gateway.34436 > netviews.ssh: Flags [.], ack 4881, win 65535, length 0
11:52:55.558558 IP netviews.ssh > _gateway.34436: Flags [P.], seq 4881:4925, ack 124, win 62780, length 44
11:52:55.558773 IP _gateway.34436 > netviews.ssh: Flags [.], ack 4925, win 65535, length 0
11:52:55.574514 IP netviews.ssh > _gateway.34436: Flags [P.], seq 4925:4977, ack 124, win 62780, length 52
11:52:55.574772 IP _gateway.34436 > netviews.ssh: Flags [.], ack 4977, win 65535, length 0
11:52:55.586341 IP netviews.ssh > _gateway.34436: Flags [P.], seq 4977:5029, ack 124, win 62780, length 52
11:52:55.586615 IP _gateway.34436 > netviews.ssh: Flags [.], ack 5029, win 65535, length 0
11:52:55.590797 IP netviews.ssh > _gateway.34436: Flags [P.], seq 5029:5073, ack 124, win 62780, length 44
11:52:55.591005 IP _gateway.34436 > netviews.ssh: Flags [.], ack 5073, win 65535, length 0
11:52:55.606699 IP netviews.ssh > _gateway.34436: Flags [P.], seq 5073:5125, ack 124, win 62780, length 52
11:52:55.606957 IP _gateway.34436 > netviews.ssh: Flags [.], ack 5125, win 65535, length 0
11:52:55.617934 IP netviews.ssh > _gateway.34436: Flags [P.], seq 5125:5177, ack 124, win 62780, length 52
11:52:55.618120 IP _gateway.34436 > netviews.ssh: Flags [.], ack 5177, win 65535, length 0
11:52:55.627020 IP netviews.ssh > _gateway.34436: Flags [P.], seq 5177:5221, ack 124, win 62780, length 44
11:52:55.627246 IP _gateway.34436 > netviews.ssh: Flags [.], ack 5221, win 65535, length 0
11:52:55.642591 IP netviews.ssh > _gateway.34436: Flags [P.], seq 5221:5273, ack 124, win 62780, length 52
11:52:55.642879 IP _gateway.34436 > netviews.ssh: Flags [.], ack 5273, win 65535, length 0
11:52:55.660026 IP netviews.ssh > _gateway.34436: Flags [P.], seq 5273:5325, ack 124, win 62780, length 52
11:52:55.660188 IP _gateway.34436 > netviews.ssh: Flags [.], ack 5325, win 65535, length 0
11:52:55.669321 IP netviews.ssh > _gateway.34436: Flags [P.], seq 5325:5369, ack 124, win 62780, length 44
11:52:55.669556 IP _gateway.34436 > netviews.ssh: Flags [.], ack 5369, win 65535, length 0
11:52:55.685303 IP netviews.ssh > _gateway.34436: Flags [P.], seq 5369:5421, ack 124, win 62780, length 52
11:52:55.685599 IP _gateway.34436 > netviews.ssh: Flags [.], ack 5421, win 65535, length 0
11:52:55.702345 IP netviews.ssh > _gateway.34436: Flags [P.], seq 5421:5473, ack 124, win 62780, length 52
11:52:55.702470 IP _gateway.34436 > netviews.ssh: Flags [.], ack 5473, win 65535, length 0
11:52:55.711072 IP netviews.ssh > _gateway.34436: Flags [P.], seq 5473:5517, ack 124, win 62780, length 44
11:52:55.711244 IP _gateway.34436 > netviews.ssh: Flags [.], ack 5517, win 65535, length 0
11:52:55.728549 IP netviews.ssh > _gateway.34436: Flags [P.], seq 5517:5569, ack 124, win 62780, length 52
11:52:55.728836 IP _gateway.34436 > netviews.ssh: Flags [.], ack 5569, win 65535, length 0
11:52:55.744203 IP netviews.ssh > _gateway.34436: Flags [P.], seq 5569:5621, ack 124, win 62780, length 52
11:52:55.744371 IP _gateway.34436 > netviews.ssh: Flags [.], ack 5621, win 65535, length 0
11:52:55.754974 IP netviews.ssh > _gateway.34436: Flags [P.], seq 5621:5665, ack 124, win 62780, length 44
11:52:55.755248 IP _gateway.34436 > netviews.ssh: Flags [.], ack 5665, win 65535, length 0
11:52:55.770361 IP netviews.ssh > _gateway.34436: Flags [P.], seq 5665:5717, ack 124, win 62780, length 52
11:52:55.770650 IP _gateway.34436 > netviews.ssh: Flags [.], ack 5717, win 65535, length 0
11:52:55.790086 IP netviews.ssh > _gateway.34436: Flags [P.], seq 5717:5769, ack 124, win 62780, length 52
11:52:55.790213 IP _gateway.34436 > netviews.ssh: Flags [.], ack 5769, win 65535, length 0
11:52:55.799117 IP netviews.ssh > _gateway.34436: Flags [P.], seq 5769:5813, ack 124, win 62780, length 44
11:52:55.799267 IP netviews.ssh > _gateway.34436: Flags [P.], seq 5813:5873, ack 124, win 62780, length 60
11:52:55.799285 IP _gateway.34436 > netviews.ssh: Flags [.], ack 5813, win 65535, length 0
11:52:55.799501 IP _gateway.34436 > netviews.ssh: Flags [.], ack 5873, win 65535, length 0
11:52:55.799614 IP netviews.ssh > _gateway.34436: Flags [P.], seq 5873:5917, ack 124, win 62780, length 44
11:52:55.799736 IP _gateway.34436 > netviews.ssh: Flags [.], ack 5917, win 65535, length 0
11:52:55.806186 IP netviews.ssh > _gateway.34436: Flags [P.], seq 5917:5961, ack 124, win 62780, length 44
11:52:55.806436 IP _gateway.34436 > netviews.ssh: Flags [.], ack 5961, win 65535, length 0
11:52:55.812727 IP netviews.ssh > _gateway.34436: Flags [P.], seq 5961:6005, ack 124, win 62780, length 44
11:52:55.813005 IP _gateway.34436 > netviews.ssh: Flags [.], ack 6005, win 65535, length 0
11:52:55.819998 IP netviews.ssh > _gateway.34436: Flags [P.], seq 6005:6049, ack 124, win 62780, length 44
11:52:55.820307 IP _gateway.34436 > netviews.ssh: Flags [.], ack 6049, win 65535, length 0
11:52:55.827524 IP netviews.ssh > _gateway.34436: Flags [P.], seq 6049:6093, ack 124, win 62780, length 44
11:52:55.827825 IP _gateway.34436 > netviews.ssh: Flags [.], ack 6093, win 65535, length 0
11:52:55.834861 IP netviews.ssh > _gateway.34436: Flags [P.], seq 6093:6137, ack 124, win 62780, length 44
11:52:55.835186 IP _gateway.34436 > netviews.ssh: Flags [.], ack 6137, win 65535, length 0
11:52:55.842670 IP netviews.ssh > _gateway.34436: Flags [P.], seq 6137:6181, ack 124, win 62780, length 44
11:52:55.842993 IP _gateway.34436 > netviews.ssh: Flags [.], ack 6181, win 65535, length 0
11:52:55.849631 IP netviews.ssh > _gateway.34436: Flags [P.], seq 6181:6225, ack 124, win 62780, length 44
11:52:55.849990 IP _gateway.34436 > netviews.ssh: Flags [.], ack 6225, win 65535, length 0
11:52:55.857153 IP netviews.ssh > _gateway.34436: Flags [P.], seq 6225:6269, ack 124, win 62780, length 44
11:52:55.857501 IP _gateway.34436 > netviews.ssh: Flags [.], ack 6269, win 65535, length 0
11:52:55.862692 IP netviews.ssh > _gateway.34436: Flags [P.], seq 6269:6313, ack 124, win 62780, length 44
11:52:55.862967 IP _gateway.34436 > netviews.ssh: Flags [.], ack 6313, win 65535, length 0
11:52:55.869209 IP netviews.ssh > _gateway.34436: Flags [P.], seq 6313:6357, ack 124, win 62780, length 44
11:52:55.869511 IP _gateway.34436 > netviews.ssh: Flags [.], ack 6357, win 65535, length 0
11:52:55.877161 IP netviews.ssh > _gateway.34436: Flags [P.], seq 6357:6401, ack 124, win 62780, length 44
11:52:55.877443 IP _gateway.34436 > netviews.ssh: Flags [.], ack 6401, win 65535, length 0
11:52:55.883527 IP netviews.ssh > _gateway.34436: Flags [P.], seq 6401:6437, ack 124, win 62780, length 36
11:52:55.883846 IP _gateway.34436 > netviews.ssh: Flags [.], ack 6437, win 65535, length 0
11:52:55.886367 IP netviews.ssh > _gateway.34436: Flags [P.], seq 6437:6497, ack 124, win 62780, length 60
11:52:55.886597 IP netviews.ssh > _gateway.34436: Flags [P.], seq 6497:6601, ack 124, win 62780, length 104
11:52:55.886670 IP _gateway.34436 > netviews.ssh: Flags [.], ack 6497, win 65535, length 0
11:52:55.886832 IP _gateway.34436 > netviews.ssh: Flags [.], ack 6601, win 65535, length 0
11:52:55.887074 IP netviews.ssh > _gateway.34436: Flags [P.], seq 6601:6637, ack 124, win 62780, length 36
11:52:55.887204 IP netviews.ssh > _gateway.34436: Flags [P.], seq 6637:6697, ack 124, win 62780, length 60
11:52:55.887318 IP _gateway.34436 > netviews.ssh: Flags [.], ack 6637, win 65535, length 0
11:52:55.887318 IP _gateway.34436 > netviews.ssh: Flags [.], ack 6697, win 65535, length 0
11:52:55.887664 IP netviews.ssh > _gateway.34436: Flags [P.], seq 6697:6741, ack 124, win 62780, length 44
11:52:55.887863 IP _gateway.34436 > netviews.ssh: Flags [.], ack 6741, win 65535, length 0
11:52:55.888495 IP netviews.ssh > _gateway.34436: Flags [P.], seq 6741:6785, ack 124, win 62780, length 44
11:52:55.888719 IP _gateway.34436 > netviews.ssh: Flags [.], ack 6785, win 65535, length 0
11:52:55.889111 IP netviews.ssh > _gateway.34436: Flags [P.], seq 6785:6829, ack 124, win 62780, length 44
11:52:55.889287 IP _gateway.34436 > netviews.ssh: Flags [.], ack 6829, win 65535, length 0
11:52:55.889506 IP netviews.ssh > _gateway.34436: Flags [P.], seq 6829:6873, ack 124, win 62780, length 44
11:52:55.889641 IP _gateway.34436 > netviews.ssh: Flags [.], ack 6873, win 65535, length 0
11:52:55.889774 IP netviews.ssh > _gateway.34436: Flags [P.], seq 6873:6917, ack 124, win 62780, length 44
11:52:55.889918 IP _gateway.34436 > netviews.ssh: Flags [.], ack 6917, win 65535, length 0
11:52:55.889932 IP netviews.ssh > _gateway.34436: Flags [P.], seq 6917:6961, ack 124, win 62780, length 44
11:52:55.890098 IP _gateway.34436 > netviews.ssh: Flags [.], ack 6961, win 65535, length 0
11:52:55.890382 IP netviews.ssh > _gateway.34436: Flags [P.], seq 6961:7005, ack 124, win 62780, length 44
11:52:55.890498 IP _gateway.34436 > netviews.ssh: Flags [.], ack 7005, win 65535, length 0
11:52:55.890624 IP netviews.ssh > _gateway.34436: Flags [P.], seq 7005:7049, ack 124, win 62780, length 44
11:52:55.890741 IP _gateway.34436 > netviews.ssh: Flags [.], ack 7049, win 65535, length 0
11:52:55.890959 IP netviews.ssh > _gateway.34436: Flags [P.], seq 7049:7093, ack 124, win 62780, length 44
11:52:55.891072 IP _gateway.34436 > netviews.ssh: Flags [.], ack 7093, win 65535, length 0
11:52:55.891288 IP netviews.ssh > _gateway.34436: Flags [P.], seq 7093:7137, ack 124, win 62780, length 44
11:52:55.891691 IP _gateway.34436 > netviews.ssh: Flags [.], ack 7137, win 65535, length 0
11:52:55.891944 IP netviews.ssh > _gateway.34436: Flags [P.], seq 7137:7181, ack 124, win 62780, length 44
11:52:55.892069 IP _gateway.34436 > netviews.ssh: Flags [.], ack 7181, win 65535, length 0
11:52:56.126304 IP netviews.ssh > _gateway.34432: Flags [P.], seq 772:1000, ack 1, win 62780, length 228
11:52:56.126542 IP _gateway.34432 > netviews.ssh: Flags [.], ack 1000, win 65535, length 0
11:52:56.126794 IP _gateway.34432 > netviews.ssh: Flags [P.], seq 1:37, ack 1000, win 65535, length 36
11:52:56.167747 IP netviews.ssh > _gateway.34432: Flags [.], ack 37, win 62780, length 0
11:52:56.191048 IP netviews.ssh > _gateway.34432: Flags [P.], seq 1000:1228, ack 37, win 62780, length 228
11:52:56.191413 IP _gateway.34432 > netviews.ssh: Flags [.], ack 1228, win 65535, length 0
11:52:56.247413 IP netviews.ssh > _gateway.34432: Flags [P.], seq 1228:1456, ack 37, win 62780, length 228
11:52:56.247790 IP _gateway.34432 > netviews.ssh: Flags [.], ack 1456, win 65535, length 0
11:52:56.301361 IP netviews.ssh > _gateway.34432: Flags [P.], seq 1456:1684, ack 37, win 62780, length 228
11:52:56.301716 IP _gateway.34432 > netviews.ssh: Flags [.], ack 1684, win 65535, length 0
11:52:56.356776 IP netviews.ssh > _gateway.34432: Flags [P.], seq 1684:1912, ack 37, win 62780, length 228
11:52:56.357150 IP _gateway.34432 > netviews.ssh: Flags [.], ack 1912, win 65535, length 0
11:52:56.410969 IP netviews.ssh > _gateway.34432: Flags [P.], seq 1912:2140, ack 37, win 62780, length 228
11:52:56.411322 IP _gateway.34432 > netviews.ssh: Flags [.], ack 2140, win 65535, length 0
11:52:56.466963 IP netviews.ssh > _gateway.34432: Flags [P.], seq 2140:2368, ack 37, win 62780, length 228
11:52:56.467290 IP _gateway.34432 > netviews.ssh: Flags [.], ack 2368, win 65535, length 0
11:52:56.522025 IP netviews.ssh > _gateway.34432: Flags [P.], seq 2368:2596, ack 37, win 62780, length 228
11:52:56.534237 IP _gateway.34432 > netviews.ssh: Flags [.], ack 2596, win 65535, length 0
11:52:56.578041 IP netviews.ssh > _gateway.34432: Flags [P.], seq 2596:2824, ack 37, win 62780, length 228
11:52:56.578398 IP _gateway.34432 > netviews.ssh: Flags [.], ack 2824, win 65535, length 0
11:52:56.633572 IP netviews.ssh > _gateway.34432: Flags [P.], seq 2824:3052, ack 37, win 62780, length 228
11:52:56.633956 IP _gateway.34432 > netviews.ssh: Flags [.], ack 3052, win 65535, length 0
11:52:56.711228 IP netviews.ssh > _gateway.34436: Flags [P.], seq 7181:7233, ack 124, win 62780, length 52
11:52:56.711513 IP _gateway.34436 > netviews.ssh: Flags [.], ack 7233, win 65535, length 0
11:52:56.722804 IP netviews.ssh > _gateway.34436: Flags [P.], seq 7233:7285, ack 124, win 62780, length 52
11:52:56.723099 IP _gateway.34436 > netviews.ssh: Flags [.], ack 7285, win 65535, length 0
11:52:56.734953 IP netviews.ssh > _gateway.34436: Flags [P.], seq 7285:7337, ack 124, win 62780, length 52
11:52:56.735172 IP _gateway.34436 > netviews.ssh: Flags [.], ack 7337, win 65535, length 0
11:52:56.763329 IP netviews.ssh > _gateway.34436: Flags [P.], seq 7337:7389, ack 124, win 62780, length 52
11:52:56.763523 IP _gateway.34436 > netviews.ssh: Flags [.], ack 7389, win 65535, length 0
11:52:56.766666 IP netviews.ssh > _gateway.34432: Flags [P.], seq 3052:4032, ack 37, win 62780, length 980
11:52:56.766838 IP _gateway.34432 > netviews.ssh: Flags [.], ack 4032, win 65535, length 0
11:52:56.766904 IP netviews.ssh > _gateway.34432: Flags [P.], seq 4032:4636, ack 37, win 62780, length 604
11:52:56.766997 IP _gateway.34432 > netviews.ssh: Flags [.], ack 4636, win 65535, length 0
11:52:56.767072 IP netviews.ssh > _gateway.34432: Flags [P.], seq 4636:4864, ack 37, win 62780, length 228
11:52:56.767207 IP _gateway.34432 > netviews.ssh: Flags [.], ack 4864, win 65535, length 0
11:52:56.767586 IP netviews.ssh > _gateway.34432: Flags [P.], seq 4864:5092, ack 37, win 62780, length 228
11:52:56.767696 IP _gateway.34432 > netviews.ssh: Flags [.], ack 5092, win 65535, length 0
11:52:56.782197 IP netviews.ssh > _gateway.34436: Flags [P.], seq 7389:7441, ack 124, win 62780, length 52
11:52:56.782356 IP _gateway.34436 > netviews.ssh: Flags [.], ack 7441, win 65535, length 0
11:52:56.812117 IP netviews.ssh > _gateway.34436: Flags [P.], seq 7441:7493, ack 124, win 62780, length 52
11:52:56.812331 IP _gateway.34436 > netviews.ssh: Flags [.], ack 7493, win 65535, length 0
11:52:56.832866 IP netviews.ssh > _gateway.34432: Flags [P.], seq 5092:5632, ack 37, win 62780, length 540
11:52:56.833102 IP _gateway.34432 > netviews.ssh: Flags [.], ack 5632, win 65535, length 0
11:52:56.833244 IP netviews.ssh > _gateway.34432: Flags [P.], seq 5632:6172, ack 37, win 62780, length 540
11:52:56.833377 IP _gateway.34432 > netviews.ssh: Flags [.], ack 6172, win 65535, length 0
11:52:56.833445 IP netviews.ssh > _gateway.34432: Flags [P.], seq 6172:6712, ack 37, win 62780, length 540
11:52:56.833576 IP _gateway.34432 > netviews.ssh: Flags [.], ack 6712, win 65535, length 0
11:52:56.833811 IP netviews.ssh > _gateway.34432: Flags [P.], seq 6712:6996, ack 37, win 62780, length 284
11:52:56.833961 IP _gateway.34432 > netviews.ssh: Flags [.], ack 6996, win 65535, length 0
11:52:56.834027 IP netviews.ssh > _gateway.34432: Flags [P.], seq 6996:7280, ack 37, win 62780, length 284
11:52:56.834151 IP _gateway.34432 > netviews.ssh: Flags [.], ack 7280, win 65535, length 0
11:52:56.834475 IP netviews.ssh > _gateway.34432: Flags [P.], seq 7280:7564, ack 37, win 62780, length 284
11:52:56.834611 IP _gateway.34432 > netviews.ssh: Flags [.], ack 7564, win 65535, length 0
11:52:56.835098 IP netviews.ssh > _gateway.34432: Flags [P.], seq 7564:7848, ack 37, win 62780, length 284
11:52:56.835243 IP _gateway.34432 > netviews.ssh: Flags [.], ack 7848, win 65535, length 0
11:52:56.838444 IP netviews.ssh > _gateway.34436: Flags [P.], seq 7493:7545, ack 124, win 62780, length 52
11:52:56.838593 IP _gateway.34436 > netviews.ssh: Flags [.], ack 7545, win 65535, length 0
11:52:56.841050 IP netviews.ssh > _gateway.34432: Flags [P.], seq 7848:8652, ack 37, win 62780, length 804
11:52:56.841159 IP _gateway.34432 > netviews.ssh: Flags [.], ack 8652, win 65535, length 0
11:52:56.841205 IP netviews.ssh > _gateway.34432: Flags [P.], seq 8652:8944, ack 37, win 62780, length 292
11:52:56.841380 IP _gateway.34432 > netviews.ssh: Flags [.], ack 8944, win 65535, length 0
11:52:56.841390 IP netviews.ssh > _gateway.34432: Flags [P.], seq 8944:9236, ack 37, win 62780, length 292
11:52:56.841522 IP _gateway.34432 > netviews.ssh: Flags [.], ack 9236, win 65535, length 0
11:52:56.841671 IP netviews.ssh > _gateway.34432: Flags [P.], seq 9236:9528, ack 37, win 62780, length 292
11:52:56.841778 IP _gateway.34432 > netviews.ssh: Flags [.], ack 9528, win 65535, length 0
11:52:56.842044 IP netviews.ssh > _gateway.34432: Flags [P.], seq 9528:9820, ack 37, win 62780, length 292
11:52:56.842155 IP _gateway.34432 > netviews.ssh: Flags [.], ack 9820, win 65535, length 0
11:52:56.842510 IP netviews.ssh > _gateway.34432: Flags [P.], seq 9820:10112, ack 37, win 62780, length 292
11:52:56.842618 IP _gateway.34432 > netviews.ssh: Flags [.], ack 10112, win 65535, length 0
11:52:56.842665 IP netviews.ssh > _gateway.34432: Flags [P.], seq 10112:10404, ack 37, win 62780, length 292
11:52:56.842761 IP _gateway.34432 > netviews.ssh: Flags [.], ack 10404, win 65535, length 0
11:52:56.842933 IP netviews.ssh > _gateway.34432: Flags [P.], seq 10404:10696, ack 37, win 62780, length 292
11:52:56.843032 IP _gateway.34432 > netviews.ssh: Flags [.], ack 10696, win 65535, length 0
11:52:56.848754 IP netviews.ssh > _gateway.34432: Flags [P.], seq 10696:11428, ack 37, win 62780, length 732
11:52:56.848898 IP _gateway.34432 > netviews.ssh: Flags [.], ack 11428, win 65535, length 0
11:52:56.848948 IP netviews.ssh > _gateway.34432: Flags [P.], seq 11428:11816, ack 37, win 62780, length 388
11:52:56.849055 IP _gateway.34432 > netviews.ssh: Flags [.], ack 11816, win 65535, length 0
11:52:56.849112 IP netviews.ssh > _gateway.34432: Flags [P.], seq 11816:12204, ack 37, win 62780, length 388
11:52:56.849213 IP _gateway.34432 > netviews.ssh: Flags [.], ack 12204, win 65535, length 0
11:52:56.849485 IP netviews.ssh > _gateway.34432: Flags [P.], seq 12204:12592, ack 37, win 62780, length 388
11:52:56.849605 IP _gateway.34432 > netviews.ssh: Flags [.], ack 12592, win 65535, length 0
11:52:56.849659 IP netviews.ssh > _gateway.34432: Flags [P.], seq 12592:12980, ack 37, win 62780, length 388
11:52:56.849760 IP _gateway.34432 > netviews.ssh: Flags [.], ack 12980, win 65535, length 0
11:52:56.849825 IP netviews.ssh > _gateway.34432: Flags [P.], seq 12980:13368, ack 37, win 62780, length 388
11:52:56.849950 IP _gateway.34432 > netviews.ssh: Flags [.], ack 13368, win 65535, length 0
11:52:56.850009 IP netviews.ssh > _gateway.34432: Flags [P.], seq 13368:13756, ack 37, win 62780, length 388
11:52:56.850115 IP _gateway.34432 > netviews.ssh: Flags [.], ack 13756, win 65535, length 0
11:52:56.860004 IP netviews.ssh > _gateway.34432: Flags [P.], seq 13756:14488, ack 37, win 62780, length 732
11:52:56.860166 IP _gateway.34432 > netviews.ssh: Flags [.], ack 14488, win 65535, length 0
11:52:56.864337 IP netviews.ssh > _gateway.34436: Flags [P.], seq 7545:7597, ack 124, win 62780, length 52
11:52:56.864488 IP _gateway.34436 > netviews.ssh: Flags [.], ack 7597, win 65535, length 0
11:52:56.868319 IP netviews.ssh > _gateway.34432: Flags [P.], seq 14488:14932, ack 37, win 62780, length 444
11:52:56.868476 IP _gateway.34432 > netviews.ssh: Flags [.], ack 14932, win 65535, length 0
11:52:56.868929 IP netviews.ssh > _gateway.34432: Flags [P.], seq 14932:15176, ack 37, win 62780, length 244
11:52:56.869085 IP _gateway.34432 > netviews.ssh: Flags [.], ack 15176, win 65535, length 0
11:52:56.869154 IP netviews.ssh > _gateway.34432: Flags [P.], seq 15176:15420, ack 37, win 62780, length 244
11:52:56.869273 IP _gateway.34432 > netviews.ssh: Flags [.], ack 15420, win 65535, length 0
11:52:56.871765 IP netviews.ssh > _gateway.34432: Flags [P.], seq 15420:15664, ack 37, win 62780, length 244
11:52:56.871875 IP _gateway.34432 > netviews.ssh: Flags [.], ack 15664, win 65535, length 0
11:52:56.872908 IP netviews.ssh > _gateway.34432: Flags [P.], seq 15664:15908, ack 37, win 62780, length 244
11:52:56.873022 IP _gateway.34432 > netviews.ssh: Flags [.], ack 15908, win 65535, length 0
11:52:56.875330 IP netviews.ssh > _gateway.34432: Flags [P.], seq 15908:16152, ack 37, win 62780, length 244
11:52:56.875447 IP _gateway.34432 > netviews.ssh: Flags [.], ack 16152, win 65535, length 0
11:52:56.875986 IP netviews.ssh > _gateway.34432: Flags [P.], seq 16152:16396, ack 37, win 62780, length 244
11:52:56.876112 IP _gateway.34432 > netviews.ssh: Flags [.], ack 16396, win 65535, length 0
11:52:56.878244 IP netviews.ssh > _gateway.34432: Flags [P.], seq 16396:16640, ack 37, win 62780, length 244
11:52:56.878403 IP _gateway.34432 > netviews.ssh: Flags [.], ack 16640, win 65535, length 0
11:52:56.880461 IP netviews.ssh > _gateway.34432: Flags [P.], seq 16640:16884, ack 37, win 62780, length 244
11:52:56.880590 IP _gateway.34432 > netviews.ssh: Flags [.], ack 16884, win 65535, length 0
11:52:56.880741 IP netviews.ssh > _gateway.34432: Flags [P.], seq 16884:17512, ack 37, win 62780, length 628
11:52:56.880856 IP _gateway.34432 > netviews.ssh: Flags [.], ack 17512, win 65535, length 0
11:52:56.880916 IP netviews.ssh > _gateway.34432: Flags [P.], seq 17512:18140, ack 37, win 62780, length 628
11:52:56.881042 IP _gateway.34432 > netviews.ssh: Flags [.], ack 18140, win 65535, length 0
11:52:56.881099 IP netviews.ssh > _gateway.34432: Flags [P.], seq 18140:18568, ack 37, win 62780, length 428
11:52:56.881240 IP _gateway.34432 > netviews.ssh: Flags [.], ack 18568, win 65535, length 0
11:52:56.881683 IP netviews.ssh > _gateway.34432: Flags [P.], seq 18568:18804, ack 37, win 62780, length 236
11:52:56.881821 IP _gateway.34432 > netviews.ssh: Flags [.], ack 18804, win 65535, length 0
11:52:56.881886 IP netviews.ssh > _gateway.34432: Flags [P.], seq 18804:19040, ack 37, win 62780, length 236
11:52:56.881995 IP _gateway.34432 > netviews.ssh: Flags [.], ack 19040, win 65535, length 0
11:52:56.883368 IP netviews.ssh > _gateway.34436: Flags [P.], seq 7597:7649, ack 124, win 62780, length 52
11:52:56.883511 IP _gateway.34436 > netviews.ssh: Flags [.], ack 7649, win 65535, length 0
11:52:56.897547 IP netviews.ssh > _gateway.34432: Flags [P.], seq 19040:19732, ack 37, win 62780, length 692
11:52:56.897737 IP _gateway.34432 > netviews.ssh: Flags [.], ack 19732, win 65535, length 0
11:52:56.897891 IP netviews.ssh > _gateway.34432: Flags [P.], seq 19732:19984, ack 37, win 62780, length 252
11:52:56.898046 IP _gateway.34432 > netviews.ssh: Flags [.], ack 19984, win 65535, length 0
11:52:56.898112 IP netviews.ssh > _gateway.34432: Flags [P.], seq 19984:20676, ack 37, win 62780, length 692
11:52:56.898235 IP _gateway.34432 > netviews.ssh: Flags [.], ack 20676, win 65535, length 0
11:52:56.898291 IP netviews.ssh > _gateway.34432: Flags [P.], seq 20676:20928, ack 37, win 62780, length 252
11:52:56.898429 IP _gateway.34432 > netviews.ssh: Flags [.], ack 20928, win 65535, length 0
11:52:56.898483 IP netviews.ssh > _gateway.34432: Flags [P.], seq 20928:21180, ack 37, win 62780, length 252
11:52:56.898609 IP _gateway.34432 > netviews.ssh: Flags [.], ack 21180, win 65535, length 0
11:52:56.899265 IP netviews.ssh > _gateway.34432: Flags [P.], seq 21180:21432, ack 37, win 62780, length 252
11:52:56.899411 IP _gateway.34432 > netviews.ssh: Flags [.], ack 21432, win 65535, length 0
11:52:56.907452 IP netviews.ssh > _gateway.34436: Flags [P.], seq 7649:7701, ack 124, win 62780, length 52
11:52:56.907621 IP _gateway.34436 > netviews.ssh: Flags [.], ack 7701, win 65535, length 0
11:52:56.927818 IP netviews.ssh > _gateway.34432: Flags [P.], seq 21432:22012, ack 37, win 62780, length 580
11:52:56.928012 IP _gateway.34432 > netviews.ssh: Flags [.], ack 22012, win 65535, length 0
11:52:56.928984 IP netviews.ssh > _gateway.34432: Flags [P.], seq 22012:22232, ack 37, win 62780, length 220
11:52:56.929089 IP _gateway.34432 > netviews.ssh: Flags [.], ack 22232, win 65535, length 0
11:52:56.929251 IP netviews.ssh > _gateway.34432: Flags [P.], seq 22232:22628, ack 37, win 62780, length 396
11:52:56.929354 IP _gateway.34432 > netviews.ssh: Flags [.], ack 22628, win 65535, length 0
11:52:56.929395 IP netviews.ssh > _gateway.34432: Flags [P.], seq 22628:23024, ack 37, win 62780, length 396
11:52:56.929528 IP _gateway.34432 > netviews.ssh: Flags [.], ack 23024, win 65535, length 0
11:52:56.929575 IP netviews.ssh > _gateway.34432: Flags [P.], seq 23024:23244, ack 37, win 62780, length 220
11:52:56.929680 IP _gateway.34432 > netviews.ssh: Flags [.], ack 23244, win 65535, length 0
11:52:56.929911 IP netviews.ssh > _gateway.34432: Flags [P.], seq 23244:23464, ack 37, win 62780, length 220
11:52:56.930026 IP _gateway.34432 > netviews.ssh: Flags [.], ack 23464, win 65535, length 0
11:52:56.937663 IP netviews.ssh > _gateway.34432: Flags [P.], seq 23464:23708, ack 37, win 62780, length 244
11:52:56.937807 IP _gateway.34432 > netviews.ssh: Flags [.], ack 23708, win 65535, length 0
11:52:56.939047 IP netviews.ssh > _gateway.34432: Flags [P.], seq 23708:23952, ack 37, win 62780, length 244
11:52:56.939168 IP _gateway.34432 > netviews.ssh: Flags [.], ack 23952, win 65535, length 0
11:52:56.939645 IP netviews.ssh > _gateway.34432: Flags [P.], seq 23952:24196, ack 37, win 62780, length 244
11:52:56.939783 IP _gateway.34432 > netviews.ssh: Flags [.], ack 24196, win 65535, length 0
11:52:56.940059 IP netviews.ssh > _gateway.34432: Flags [P.], seq 24196:24440, ack 37, win 62780, length 244
11:52:56.940184 IP _gateway.34432 > netviews.ssh: Flags [.], ack 24440, win 65535, length 0
11:52:56.940276 IP netviews.ssh > _gateway.34432: Flags [P.], seq 24440:24684, ack 37, win 62780, length 244
11:52:56.940393 IP _gateway.34432 > netviews.ssh: Flags [.], ack 24684, win 65535, length 0
11:52:56.940982 IP netviews.ssh > _gateway.34432: Flags [P.], seq 24684:25136, ack 37, win 62780, length 452
11:52:56.941117 IP _gateway.34432 > netviews.ssh: Flags [.], ack 25136, win 65535, length 0
11:52:56.942359 IP netviews.ssh > _gateway.34432: Flags [P.], seq 25136:25380, ack 37, win 62780, length 244
11:52:56.942494 IP _gateway.34432 > netviews.ssh: Flags [.], ack 25380, win 65535, length 0
11:52:56.951790 IP netviews.ssh > _gateway.34436: Flags [P.], seq 7701:7753, ack 124, win 62780, length 52
11:52:56.951970 IP _gateway.34436 > netviews.ssh: Flags [.], ack 7753, win 65535, length 0
11:52:56.952732 IP netviews.ssh > _gateway.34432: Flags [P.], seq 25380:25624, ack 37, win 62780, length 244
11:52:56.952873 IP _gateway.34432 > netviews.ssh: Flags [.], ack 25624, win 65535, length 0
11:52:56.953302 IP netviews.ssh > _gateway.34432: Flags [P.], seq 25624:25868, ack 37, win 62780, length 244
11:52:56.953433 IP _gateway.34432 > netviews.ssh: Flags [.], ack 25868, win 65535, length 0
11:52:56.953547 IP netviews.ssh > _gateway.34432: Flags [P.], seq 25868:26112, ack 37, win 62780, length 244
11:52:56.953667 IP _gateway.34432 > netviews.ssh: Flags [.], ack 26112, win 65535, length 0
11:52:56.954116 IP netviews.ssh > _gateway.34432: Flags [P.], seq 26112:26356, ack 37, win 62780, length 244
11:52:56.954255 IP _gateway.34432 > netviews.ssh: Flags [.], ack 26356, win 65535, length 0
11:52:56.954380 IP netviews.ssh > _gateway.34432: Flags [P.], seq 26356:26600, ack 37, win 62780, length 244
11:52:56.954499 IP _gateway.34432 > netviews.ssh: Flags [.], ack 26600, win 65535, length 0
11:52:56.954947 IP netviews.ssh > _gateway.34432: Flags [P.], seq 26600:26844, ack 37, win 62780, length 244
11:52:56.955053 IP _gateway.34432 > netviews.ssh: Flags [.], ack 26844, win 65535, length 0
11:52:56.955287 IP netviews.ssh > _gateway.34432: Flags [P.], seq 26844:27088, ack 37, win 62780, length 244
11:52:56.955388 IP _gateway.34432 > netviews.ssh: Flags [.], ack 27088, win 65535, length 0
11:52:56.955802 IP netviews.ssh > _gateway.34432: Flags [P.], seq 27088:27332, ack 37, win 62780, length 244
11:52:56.955910 IP _gateway.34432 > netviews.ssh: Flags [.], ack 27332, win 65535, length 0
11:52:56.955967 IP netviews.ssh > _gateway.34432: Flags [P.], seq 27332:27576, ack 37, win 62780, length 244
11:52:56.956085 IP _gateway.34432 > netviews.ssh: Flags [.], ack 27576, win 65535, length 0
11:52:56.956427 IP netviews.ssh > _gateway.34432: Flags [P.], seq 27576:27820, ack 37, win 62780, length 244
11:52:56.956547 IP _gateway.34432 > netviews.ssh: Flags [.], ack 27820, win 65535, length 0
11:52:56.956856 IP netviews.ssh > _gateway.34432: Flags [P.], seq 27820:28064, ack 37, win 62780, length 244
11:52:56.956979 IP _gateway.34432 > netviews.ssh: Flags [.], ack 28064, win 65535, length 0
11:52:56.958481 IP netviews.ssh > _gateway.34432: Flags [P.], seq 28064:28276, ack 37, win 62780, length 212
11:52:56.958635 IP _gateway.34432 > netviews.ssh: Flags [.], ack 28276, win 65535, length 0
11:52:56.958911 IP netviews.ssh > _gateway.34432: Flags [P.], seq 28276:28488, ack 37, win 62780, length 212
11:52:56.959036 IP _gateway.34432 > netviews.ssh: Flags [.], ack 28488, win 65535, length 0
11:52:56.959539 IP netviews.ssh > _gateway.34432: Flags [P.], seq 28488:29044, ack 37, win 62780, length 556
11:52:56.959695 IP _gateway.34432 > netviews.ssh: Flags [.], ack 29044, win 65535, length 0
11:52:56.959766 IP netviews.ssh > _gateway.34432: Flags [P.], seq 29044:29256, ack 37, win 62780, length 212
11:52:56.959889 IP _gateway.34432 > netviews.ssh: Flags [.], ack 29256, win 65535, length 0
11:52:56.959955 IP netviews.ssh > _gateway.34432: Flags [P.], seq 29256:29636, ack 37, win 62780, length 380
11:52:56.960075 IP _gateway.34432 > netviews.ssh: Flags [.], ack 29636, win 65535, length 0
11:52:56.960135 IP netviews.ssh > _gateway.34432: Flags [P.], seq 29636:29880, ack 37, win 62780, length 244
11:52:56.960247 IP _gateway.34432 > netviews.ssh: Flags [.], ack 29880, win 65535, length 0
11:52:56.960307 IP netviews.ssh > _gateway.34432: Flags [P.], seq 29880:30092, ack 37, win 62780, length 212
11:52:56.960433 IP _gateway.34432 > netviews.ssh: Flags [.], ack 30092, win 65535, length 0
11:52:56.960745 IP netviews.ssh > _gateway.34432: Flags [P.], seq 30092:30304, ack 37, win 62780, length 212
11:52:56.960908 IP _gateway.34432 > netviews.ssh: Flags [.], ack 30304, win 65535, length 0
11:52:56.966098 IP netviews.ssh > _gateway.34436: Flags [P.], seq 7753:7805, ack 124, win 62780, length 52
11:52:56.966340 IP _gateway.34436 > netviews.ssh: Flags [.], ack 7805, win 65535, length 0
11:52:56.982272 IP netviews.ssh > _gateway.34436: Flags [P.], seq 7805:7857, ack 124, win 62780, length 52
11:52:56.982497 IP _gateway.34436 > netviews.ssh: Flags [.], ack 7857, win 65535, length 0
11:52:56.992630 IP netviews.ssh > _gateway.34432: Flags [P.], seq 30304:30780, ack 37, win 62780, length 476
11:52:56.992906 IP _gateway.34432 > netviews.ssh: Flags [.], ack 30780, win 65535, length 0
11:52:56.994627 IP netviews.ssh > _gateway.34432: Flags [P.], seq 30780:31472, ack 37, win 62780, length 692
11:52:56.994838 IP _gateway.34432 > netviews.ssh: Flags [.], ack 31472, win 65535, length 0
11:52:56.995827 IP netviews.ssh > _gateway.34432: Flags [P.], seq 31472:31948, ack 37, win 62780, length 476
11:52:56.996024 IP _gateway.34432 > netviews.ssh: Flags [.], ack 31948, win 65535, length 0
11:52:56.996579 IP netviews.ssh > _gateway.34432: Flags [P.], seq 31948:32208, ack 37, win 62780, length 260
11:52:56.996761 IP _gateway.34432 > netviews.ssh: Flags [.], ack 32208, win 65535, length 0
11:52:56.997386 IP netviews.ssh > _gateway.34432: Flags [P.], seq 32208:32900, ack 37, win 62780, length 692
11:52:56.997550 IP _gateway.34432 > netviews.ssh: Flags [.], ack 32900, win 65535, length 0
11:52:56.998870 IP netviews.ssh > _gateway.34432: Flags [P.], seq 32900:33152, ack 37, win 62780, length 252
11:52:56.999051 IP _gateway.34432 > netviews.ssh: Flags [.], ack 33152, win 65535, length 0
11:52:57.000844 IP netviews.ssh > _gateway.34436: Flags [P.], seq 7857:7909, ack 124, win 62780, length 52
11:52:57.001008 IP _gateway.34436 > netviews.ssh: Flags [.], ack 7909, win 65535, length 0
11:52:57.013126 IP netviews.ssh > _gateway.34432: Flags [P.], seq 33152:33404, ack 37, win 62780, length 252
11:52:57.013283 IP _gateway.34432 > netviews.ssh: Flags [.], ack 33404, win 65535, length 0
11:52:57.013700 IP netviews.ssh > _gateway.34432: Flags [P.], seq 33404:33656, ack 37, win 62780, length 252
11:52:57.013815 IP _gateway.34432 > netviews.ssh: Flags [.], ack 33656, win 65535, length 0
11:52:57.014149 IP netviews.ssh > _gateway.34432: Flags [P.], seq 33656:33908, ack 37, win 62780, length 252
11:52:57.014265 IP _gateway.34432 > netviews.ssh: Flags [.], ack 33908, win 65535, length 0
11:52:57.019804 IP netviews.ssh > _gateway.34436: Flags [P.], seq 7909:7961, ack 124, win 62780, length 52
11:52:57.019962 IP _gateway.34436 > netviews.ssh: Flags [.], ack 7961, win 65535, length 0
11:52:57.021592 IP netviews.ssh > _gateway.34432: Flags [P.], seq 33908:34160, ack 37, win 62780, length 252
11:52:57.021702 IP _gateway.34432 > netviews.ssh: Flags [.], ack 34160, win 65535, length 0
11:52:57.025447 IP netviews.ssh > _gateway.34432: Flags [P.], seq 34160:34420, ack 37, win 62780, length 260
11:52:57.025570 IP _gateway.34432 > netviews.ssh: Flags [.], ack 34420, win 65535, length 0
11:52:57.055081 IP netviews.ssh > _gateway.34436: Flags [P.], seq 7961:8013, ack 124, win 62780, length 52
11:52:57.055344 IP _gateway.34436 > netviews.ssh: Flags [.], ack 8013, win 65535, length 0
11:52:57.069299 IP netviews.ssh > _gateway.34432: Flags [P.], seq 34420:34680, ack 37, win 62780, length 260
11:52:57.069512 IP _gateway.34432 > netviews.ssh: Flags [.], ack 34680, win 65535, length 0
11:52:57.071240 IP netviews.ssh > _gateway.34432: Flags [P.], seq 34680:34940, ack 37, win 62780, length 260
11:52:57.071358 IP _gateway.34432 > netviews.ssh: Flags [.], ack 34940, win 65535, length 0
11:52:57.072554 IP netviews.ssh > _gateway.34432: Flags [P.], seq 34940:35416, ack 37, win 62780, length 476
11:52:57.072676 IP _gateway.34432 > netviews.ssh: Flags [.], ack 35416, win 65535, length 0
11:52:57.087394 IP netviews.ssh > _gateway.34436: Flags [P.], seq 8013:8065, ack 124, win 62780, length 52
11:52:57.087610 IP _gateway.34436 > netviews.ssh: Flags [.], ack 8065, win 65535, length 0
11:52:57.090093 IP netviews.ssh > _gateway.34432: Flags [P.], seq 35416:36108, ack 37, win 62780, length 692
11:52:57.090352 IP _gateway.34432 > netviews.ssh: Flags [.], ack 36108, win 65535, length 0
11:52:57.092711 IP netviews.ssh > _gateway.34432: Flags [P.], seq 36108:36584, ack 37, win 62780, length 476
11:52:57.092902 IP _gateway.34432 > netviews.ssh: Flags [.], ack 36584, win 65535, length 0
11:52:57.093844 IP netviews.ssh > _gateway.34432: Flags [P.], seq 36584:37060, ack 37, win 62780, length 476
11:52:57.093998 IP _gateway.34432 > netviews.ssh: Flags [.], ack 37060, win 65535, length 0
11:52:57.099235 IP netviews.ssh > _gateway.34432: Flags [P.], seq 37060:37312, ack 37, win 62780, length 252
11:52:57.099426 IP _gateway.34432 > netviews.ssh: Flags [.], ack 37312, win 65535, length 0
11:52:57.099795 IP netviews.ssh > _gateway.34432: Flags [P.], seq 37312:37572, ack 37, win 62780, length 260
11:52:57.099952 IP _gateway.34432 > netviews.ssh: Flags [.], ack 37572, win 65535, length 0
11:52:57.100601 IP netviews.ssh > _gateway.34432: Flags [P.], seq 37572:37824, ack 37, win 62780, length 252
11:52:57.100764 IP _gateway.34432 > netviews.ssh: Flags [.], ack 37824, win 65535, length 0
11:52:57.102517 IP netviews.ssh > _gateway.34432: Flags [P.], seq 37824:38284, ack 37, win 62780, length 460
11:52:57.102640 IP _gateway.34432 > netviews.ssh: Flags [.], ack 38284, win 65535, length 0
11:52:57.102978 IP netviews.ssh > _gateway.34432: Flags [P.], seq 38284:38536, ack 37, win 62780, length 252
11:52:57.103115 IP _gateway.34432 > netviews.ssh: Flags [.], ack 38536, win 65535, length 0
11:52:57.103238 IP netviews.ssh > _gateway.34432: Flags [P.], seq 38536:38780, ack 37, win 62780, length 244
11:52:57.103363 IP _gateway.34432 > netviews.ssh: Flags [.], ack 38780, win 65535, length 0
11:52:57.113926 IP netviews.ssh > _gateway.34432: Flags [P.], seq 38780:40904, ack 37, win 62780, length 2124
11:52:57.114150 IP _gateway.34432 > netviews.ssh: Flags [.], ack 40240, win 65535, length 0
11:52:57.114150 IP _gateway.34432 > netviews.ssh: Flags [.], ack 40904, win 65535, length 0
11:52:57.114381 IP netviews.ssh > _gateway.34432: Flags [P.], seq 40904:41164, ack 37, win 62780, length 260
11:52:57.114532 IP _gateway.34432 > netviews.ssh: Flags [.], ack 41164, win 65535, length 0
11:52:57.114631 IP netviews.ssh > _gateway.34432: Flags [P.], seq 41164:41416, ack 37, win 62780, length 252
11:52:57.114758 IP _gateway.34432 > netviews.ssh: Flags [.], ack 41416, win 65535, length 0
11:52:57.115055 IP netviews.ssh > _gateway.34432: Flags [P.], seq 41416:41660, ack 37, win 62780, length 244
11:52:57.115179 IP _gateway.34432 > netviews.ssh: Flags [.], ack 41660, win 65535, length 0
11:52:57.121360 IP netviews.ssh > _gateway.34432: Flags [P.], seq 41660:41920, ack 37, win 62780, length 260
11:52:57.121770 IP _gateway.34432 > netviews.ssh: Flags [.], ack 41920, win 65535, length 0
11:52:57.122897 IP netviews.ssh > _gateway.34432: Flags [P.], seq 41920:42172, ack 37, win 62780, length 252
11:52:57.123011 IP _gateway.34432 > netviews.ssh: Flags [.], ack 42172, win 65535, length 0
11:52:57.123147 IP netviews.ssh > _gateway.34432: Flags [P.], seq 42172:42416, ack 37, win 62780, length 244
11:52:57.123267 IP _gateway.34432 > netviews.ssh: Flags [.], ack 42416, win 65535, length 0
11:52:57.125650 IP netviews.ssh > _gateway.34432: Flags [P.], seq 42416:42676, ack 37, win 62780, length 260
11:52:57.125803 IP _gateway.34432 > netviews.ssh: Flags [.], ack 42676, win 65535, length 0
11:52:57.127482 IP netviews.ssh > _gateway.34436: Flags [P.], seq 8065:8117, ack 124, win 62780, length 52
11:52:57.127610 IP _gateway.34436 > netviews.ssh: Flags [.], ack 8117, win 65535, length 0
11:52:57.137455 IP netviews.ssh > _gateway.34432: Flags [P.], seq 42676:42984, ack 37, win 62780, length 308
11:52:57.137637 IP _gateway.34432 > netviews.ssh: Flags [.], ack 42984, win 65535, length 0
11:52:57.137666 IP netviews.ssh > _gateway.34432: Flags [P.], seq 42984:43020, ack 37, win 62780, length 36
11:52:57.137904 IP _gateway.34432 > netviews.ssh: Flags [.], ack 43020, win 65535, length 0
11:52:57.142416 IP netviews.ssh > _gateway.34432: Flags [P.], seq 43020:43272, ack 37, win 62780, length 252
11:52:57.142687 IP _gateway.34432 > netviews.ssh: Flags [.], ack 43272, win 65535, length 0
11:52:57.142714 IP netviews.ssh > _gateway.34432: Flags [P.], seq 43272:43308, ack 37, win 62780, length 36
11:52:57.142949 IP _gateway.34432 > netviews.ssh: Flags [.], ack 43308, win 65535, length 0
11:52:57.143640 IP netviews.ssh > _gateway.34432: Flags [P.], seq 43308:43560, ack 37, win 62780, length 252
11:52:57.143808 IP _gateway.34432 > netviews.ssh: Flags [.], ack 43560, win 65535, length 0
11:52:57.143832 IP netviews.ssh > _gateway.34432: Flags [P.], seq 43560:43596, ack 37, win 62780, length 36
11:52:57.143935 IP netviews.ssh > _gateway.34432: Flags [P.], seq 43596:43832, ack 37, win 62780, length 236
11:52:57.144095 IP _gateway.34432 > netviews.ssh: Flags [.], ack 43596, win 65535, length 0
11:52:57.144095 IP _gateway.34432 > netviews.ssh: Flags [.], ack 43832, win 65535, length 0
11:52:57.144109 IP netviews.ssh > _gateway.34432: Flags [P.], seq 43832:43868, ack 37, win 62780, length 36
11:52:57.144289 IP _gateway.34432 > netviews.ssh: Flags [.], ack 43868, win 65535, length 0
11:52:57.146264 IP netviews.ssh > _gateway.34432: Flags [P.], seq 43868:44176, ack 37, win 62780, length 308
11:52:57.146490 IP _gateway.34432 > netviews.ssh: Flags [.], ack 44176, win 65535, length 0
11:52:57.146753 IP netviews.ssh > _gateway.34432: Flags [P.], seq 44176:44484, ack 37, win 62780, length 308
11:52:57.146892 IP _gateway.34432 > netviews.ssh: Flags [.], ack 44484, win 65535, length 0
11:52:57.148812 IP netviews.ssh > _gateway.34436: Flags [P.], seq 8117:8169, ack 124, win 62780, length 52
11:52:57.148928 IP _gateway.34436 > netviews.ssh: Flags [.], ack 8169, win 65535, length 0
11:52:57.151463 IP netviews.ssh > _gateway.34432: Flags [P.], seq 44484:44744, ack 37, win 62780, length 260
11:52:57.152294 IP _gateway.34432 > netviews.ssh: Flags [.], ack 44744, win 65535, length 0
11:52:57.152306 IP netviews.ssh > _gateway.34432: Flags [P.], seq 44744:44780, ack 37, win 62780, length 36
11:52:57.152441 IP _gateway.34432 > netviews.ssh: Flags [.], ack 44780, win 65535, length 0
11:52:57.164230 IP netviews.ssh > _gateway.34432: Flags [P.], seq 44780:45040, ack 37, win 62780, length 260
11:52:57.164420 IP _gateway.34432 > netviews.ssh: Flags [.], ack 45040, win 65535, length 0
11:52:57.164432 IP netviews.ssh > _gateway.34432: Flags [P.], seq 45040:45076, ack 37, win 62780, length 36
11:52:57.164633 IP _gateway.34432 > netviews.ssh: Flags [.], ack 45076, win 65535, length 0
11:52:57.169499 IP netviews.ssh > _gateway.34436: Flags [P.], seq 8169:8221, ack 124, win 62780, length 52
11:52:57.169681 IP _gateway.34436 > netviews.ssh: Flags [.], ack 8221, win 65535, length 0
11:52:57.174122 IP netviews.ssh > _gateway.34432: Flags [P.], seq 45076:45384, ack 37, win 62780, length 308
11:52:57.174276 IP _gateway.34432 > netviews.ssh: Flags [.], ack 45384, win 65535, length 0
11:52:57.174296 IP netviews.ssh > _gateway.34432: Flags [P.], seq 45384:45644, ack 37, win 62780, length 260
11:52:57.174555 IP _gateway.34432 > netviews.ssh: Flags [.], ack 45644, win 65535, length 0
11:52:57.194237 IP netviews.ssh > _gateway.34436: Flags [P.], seq 8221:8273, ack 124, win 62780, length 52
11:52:57.194538 IP _gateway.34436 > netviews.ssh: Flags [.], ack 8273, win 65535, length 0
11:52:57.215993 IP netviews.ssh > _gateway.34432: Flags [P.], seq 45644:45952, ack 37, win 62780, length 308
11:52:57.216364 IP _gateway.34432 > netviews.ssh: Flags [.], ack 45952, win 65535, length 0
11:52:57.216394 IP netviews.ssh > _gateway.34432: Flags [P.], seq 45952:45988, ack 37, win 62780, length 36
11:52:57.216607 IP _gateway.34432 > netviews.ssh: Flags [.], ack 45988, win 65535, length 0
11:52:57.217647 IP netviews.ssh > _gateway.34432: Flags [P.], seq 45988:46248, ack 37, win 62780, length 260
11:52:57.217798 IP _gateway.34432 > netviews.ssh: Flags [.], ack 46248, win 65535, length 0
11:52:57.225973 IP netviews.ssh > _gateway.34436: Flags [P.], seq 8273:8325, ack 124, win 62780, length 52
11:52:57.226168 IP _gateway.34436 > netviews.ssh: Flags [.], ack 8325, win 65535, length 0
11:52:57.229335 IP netviews.ssh > _gateway.34432: Flags [P.], seq 46248:46508, ack 37, win 62780, length 260
11:52:57.229500 IP _gateway.34432 > netviews.ssh: Flags [.], ack 46508, win 65535, length 0
11:52:57.229535 IP netviews.ssh > _gateway.34432: Flags [P.], seq 46508:46544, ack 37, win 62780, length 36
11:52:57.229731 IP _gateway.34432 > netviews.ssh: Flags [.], ack 46544, win 65535, length 0
11:52:57.237059 IP netviews.ssh > _gateway.34432: Flags [P.], seq 46544:46852, ack 37, win 62780, length 308
11:52:57.237224 IP _gateway.34432 > netviews.ssh: Flags [.], ack 46852, win 65535, length 0
11:52:57.237242 IP netviews.ssh > _gateway.34432: Flags [P.], seq 46852:46888, ack 37, win 62780, length 36
11:52:57.237461 IP _gateway.34432 > netviews.ssh: Flags [.], ack 46888, win 65535, length 0
11:52:57.251192 IP netviews.ssh > _gateway.34436: Flags [P.], seq 8325:8377, ack 124, win 62780, length 52
11:52:57.251384 IP _gateway.34436 > netviews.ssh: Flags [.], ack 8377, win 65535, length 0
11:52:57.282772 IP netviews.ssh > _gateway.34436: Flags [P.], seq 8377:8429, ack 124, win 62780, length 52
11:52:57.283010 IP _gateway.34436 > netviews.ssh: Flags [.], ack 8429, win 65535, length 0
11:52:57.309261 IP netviews.ssh > _gateway.34436: Flags [P.], seq 8429:8481, ack 124, win 62780, length 52
11:52:57.309491 IP _gateway.34436 > netviews.ssh: Flags [.], ack 8481, win 65535, length 0
11:52:57.339126 IP netviews.ssh > _gateway.34436: Flags [P.], seq 8481:8533, ack 124, win 62780, length 52
11:52:57.339374 IP _gateway.34436 > netviews.ssh: Flags [.], ack 8533, win 65535, length 0
11:52:57.357349 IP netviews.ssh > _gateway.34436: Flags [P.], seq 8533:8585, ack 124, win 62780, length 52
11:52:57.357581 IP _gateway.34436 > netviews.ssh: Flags [.], ack 8585, win 65535, length 0
11:52:57.380260 IP netviews.ssh > _gateway.34436: Flags [P.], seq 8585:8637, ack 124, win 62780, length 52
11:52:57.380505 IP _gateway.34436 > netviews.ssh: Flags [.], ack 8637, win 65535, length 0
11:52:57.410977 IP netviews.ssh > _gateway.34436: Flags [P.], seq 8637:8689, ack 124, win 62780, length 52
11:52:57.411217 IP _gateway.34436 > netviews.ssh: Flags [.], ack 8689, win 65535, length 0
11:52:57.429144 IP netviews.ssh > _gateway.34436: Flags [P.], seq 8689:8741, ack 124, win 62780, length 52
11:52:57.429340 IP _gateway.34436 > netviews.ssh: Flags [.], ack 8741, win 65535, length 0
11:52:57.449197 IP netviews.ssh > _gateway.34432: Flags [P.], seq 46888:47196, ack 37, win 62780, length 308
11:52:57.449458 IP _gateway.34432 > netviews.ssh: Flags [.], ack 47196, win 65535, length 0
11:52:57.449731 IP netviews.ssh > _gateway.34436: Flags [P.], seq 8741:8793, ack 124, win 62780, length 52
11:52:57.449889 IP _gateway.34436 > netviews.ssh: Flags [.], ack 8793, win 65535, length 0
11:52:57.475004 IP netviews.ssh > _gateway.34436: Flags [P.], seq 8793:8845, ack 124, win 62780, length 52
11:52:57.475388 IP _gateway.34436 > netviews.ssh: Flags [.], ack 8845, win 65535, length 0
11:52:57.498965 IP netviews.ssh > _gateway.34436: Flags [P.], seq 8845:8897, ack 124, win 62780, length 52
11:52:57.499161 IP _gateway.34436 > netviews.ssh: Flags [.], ack 8897, win 65535, length 0
11:52:57.534291 IP netviews.ssh > _gateway.34436: Flags [P.], seq 8897:8949, ack 124, win 62780, length 52
11:52:57.534766 IP _gateway.34436 > netviews.ssh: Flags [.], ack 8949, win 65535, length 0
11:52:57.562102 IP netviews.ssh > _gateway.34436: Flags [P.], seq 8949:9001, ack 124, win 62780, length 52
11:52:57.562518 IP _gateway.34436 > netviews.ssh: Flags [.], ack 9001, win 65535, length 0
11:52:57.593144 IP netviews.ssh > _gateway.34436: Flags [P.], seq 9001:9053, ack 124, win 62780, length 52
11:52:57.593552 IP _gateway.34436 > netviews.ssh: Flags [.], ack 9053, win 65535, length 0
11:52:57.616945 IP netviews.ssh > _gateway.34436: Flags [P.], seq 9053:9105, ack 124, win 62780, length 52
11:52:57.617119 IP _gateway.34436 > netviews.ssh: Flags [.], ack 9105, win 65535, length 0
11:52:57.633930 IP netviews.ssh > _gateway.34436: Flags [P.], seq 9105:9157, ack 124, win 62780, length 52
11:52:57.634079 IP _gateway.34436 > netviews.ssh: Flags [.], ack 9157, win 65535, length 0
11:52:57.654464 IP netviews.ssh > _gateway.34436: Flags [P.], seq 9157:9209, ack 124, win 62780, length 52
11:52:57.654650 IP _gateway.34436 > netviews.ssh: Flags [.], ack 9209, win 65535, length 0
11:52:57.674933 IP netviews.ssh > _gateway.34436: Flags [P.], seq 9209:9261, ack 124, win 62780, length 52
11:52:57.675174 IP _gateway.34436 > netviews.ssh: Flags [.], ack 9261, win 65535, length 0
11:52:57.701169 IP netviews.ssh > _gateway.34436: Flags [P.], seq 9261:9313, ack 124, win 62780, length 52
11:52:57.701400 IP _gateway.34436 > netviews.ssh: Flags [.], ack 9313, win 65535, length 0
11:52:57.724738 IP netviews.ssh > _gateway.34436: Flags [P.], seq 9313:9365, ack 124, win 62780, length 52
11:52:57.724952 IP _gateway.34436 > netviews.ssh: Flags [.], ack 9365, win 65535, length 0
11:52:57.754721 IP netviews.ssh > _gateway.34436: Flags [P.], seq 9365:9417, ack 124, win 62780, length 52
11:52:57.754926 IP _gateway.34436 > netviews.ssh: Flags [.], ack 9417, win 65535, length 0
11:52:57.765948 IP netviews.ssh > _gateway.34436: Flags [P.], seq 9417:9453, ack 124, win 62780, length 36
11:52:57.766147 IP _gateway.34436 > netviews.ssh: Flags [.], ack 9453, win 65535, length 0
11:52:57.769243 IP netviews.ssh > _gateway.34436: Flags [P.], seq 9453:9561, ack 124, win 62780, length 108
11:52:57.769399 IP _gateway.34436 > netviews.ssh: Flags [.], ack 9561, win 65535, length 0
11:52:57.769779 IP netviews.ssh > _gateway.34436: Flags [P.], seq 9561:9629, ack 124, win 62780, length 68
11:52:57.769897 IP _gateway.34436 > netviews.ssh: Flags [.], ack 9629, win 65535, length 0
11:52:58.036097 IP netviews.ssh > _gateway.34432: Flags [P.], seq 47196:47448, ack 37, win 62780, length 252
11:52:58.049762 IP _gateway.34432 > netviews.ssh: Flags [.], ack 47448, win 65535, length 0
11:52:58.052713 IP netviews.ssh > _gateway.34432: Flags [P.], seq 47448:47700, ack 37, win 62780, length 252
11:52:58.052961 IP _gateway.34432 > netviews.ssh: Flags [.], ack 47700, win 65535, length 0
11:52:58.057637 IP netviews.ssh > _gateway.34432: Flags [P.], seq 47700:47952, ack 37, win 62780, length 252
11:52:58.058008 IP _gateway.34432 > netviews.ssh: Flags [.], ack 47952, win 65535, length 0
11:52:58.058051 IP netviews.ssh > _gateway.34432: Flags [P.], seq 47952:48204, ack 37, win 62780, length 252
11:52:58.058342 IP _gateway.34432 > netviews.ssh: Flags [.], ack 48204, win 65535, length 0
11:52:58.063727 IP netviews.ssh > _gateway.34432: Flags [P.], seq 48204:49312, ack 37, win 62780, length 1108
11:52:58.064051 IP _gateway.34432 > netviews.ssh: Flags [.], ack 49312, win 65535, length 0
11:52:58.064255 IP netviews.ssh > _gateway.34432: Flags [P.], seq 49312:49564, ack 37, win 62780, length 252
11:52:58.064393 IP _gateway.34432 > netviews.ssh: Flags [.], ack 49564, win 65535, length 0
11:53:00.165261 IP netviews.ssh > _gateway.34432: Flags [P.], seq 49564:49872, ack 37, win 62780, length 308
11:53:00.165709 IP _gateway.34432 > netviews.ssh: Flags [.], ack 49872, win 65535, length 0
11:53:00.429184 IP netviews.ssh > _gateway.34432: Flags [P.], seq 49872:50180, ack 37, win 62780, length 308
11:53:00.441688 IP _gateway.34432 > netviews.ssh: Flags [.], ack 50180, win 65535, length 0
11:53:07.779065 IP netviews.ssh > _gateway.34436: Flags [P.], seq 9629:9673, ack 124, win 62780, length 44
11:53:07.779567 IP _gateway.34436 > netviews.ssh: Flags [.], ack 9673, win 65535, length 0

